{
  "schema_version": 1,
  "kind": "technical-sheet-request",
  "id": "commons-building-sheet",
  "name": "Commons Hall turnaround sheet",
  "template_id": "minimal",
  "template_version": 1,
  "sheet_kind": "turnaround",
  "inputs": [{"id": "front", "label": "Commons Hall front", "reference_id": "ref-commons-front", "image_path": "normalized/commons-front.png", "sha256": "2dfce186478b8e10407a0cd1897840a5e86bf4c40f89695466fdb168821b2cae"}]
}
