{
  "schema_version": 1,
  "kind": "technical-sheet-request",
  "id": "lantern-front",
  "name": "Lantern front sheet",
  "template_id": "minimal",
  "template_version": 1,
  "sheet_kind": "prop",
  "inputs": [
    {
      "id": "front",
      "label": "Front",
      "reference_id": "ref-lantern-front",
      "image_path": "normalized/lantern-front.png",
      "sha256": "431ced6916a2a21a156e38701afe55bbd7f88969fbbfc56d7fe099d47f265460"
    }
  ]
}
