{
  "schema_version": 1,
  "kind": "technical-sheet-request",
  "id": "courier-sprite-sheet",
  "name": "Courier sprite sheet",
  "template_id": "minimal",
  "template_version": 1,
  "sheet_kind": "component",
  "inputs": [
    {
      "id": "front",
      "label": "Front sprite",
      "reference_id": "ref-courier-front",
      "image_path": "normalized/courier-front.png",
      "sha256": "30f680984b7af812f8ded0cf5f8feafebe6458d889c35d7163f5fb023c414ece"
    }
  ]
}
