{
  "schema_version": 1,
  "kind": "technical-sheet-request",
  "id": "field-plant-sheet",
  "name": "Field Plant turnaround sheet",
  "template_id": "minimal",
  "template_version": 1,
  "sheet_kind": "turnaround",
  "inputs": [{"id": "front", "label": "Field Plant front", "reference_id": "ref-field-plant-front", "image_path": "normalized/field-plant-front.png", "sha256": "2dfce186478b8e10407a0cd1897840a5e86bf4c40f89695466fdb168821b2cae"}]
}
