{
  "schema_version": 1,
  "kind": "technical-sheet-request",
  "id": "oak-tree-sheet",
  "name": "Mossbridge Oak turnaround sheet",
  "template_id": "minimal",
  "template_version": 1,
  "sheet_kind": "turnaround",
  "inputs": [{"id": "front", "label": "Mossbridge Oak front", "reference_id": "ref-oak-front", "image_path": "normalized/oak-front.png", "sha256": "2dfce186478b8e10407a0cd1897840a5e86bf4c40f89695466fdb168821b2cae"}]
}
